{"diagnostics":[{"code":"GVE-S2-DUPLICATE-IDENTITY","diagnostic_id":"gve-diagnostic-sha256:564a644c861a1ff3ceb19a79a902733f2338ffdf4c68f4d1046209cc60b2c4d9","message":"The workflow contains duplicate operation identities.","request_id":"gve-request-sha256:d667ae835271558af1ebd3651fe831ac287f57952e526535ee92c9636075437a","scope":"workflow","stage":"identity-validation","workflow_id":"canonical-stage-2-no-op"}],"lifecycle":"no-op","process":{"exit_code":2,"stderr":"empty","stdout":"authoritative-result"},"processing":{"failure_stage":"identity-validation","status":"rejected"},"request_id":"gve-request-sha256:d667ae835271558af1ebd3651fe831ac287f57952e526535ee92c9636075437a","result_id":"gve-result-sha256:91430c6dec73f5a8cb7d8567c24c05dbf5c127c5840b937b1cc76568cf928f67","schema_version":1,"workflow":{"effects":{"authorization":"indeterminate","execution":"unattempted","observation":"unobserved","request":"not-requested","verification":"unverified"},"operations":[{"effects":{"authorization":"indeterminate","execution":"unattempted","observation":"unobserved","request":"not-requested","verification":"unverified"},"operation_id":"operation-1","status":"unattempted"},{"effects":{"authorization":"indeterminate","execution":"unattempted","observation":"unobserved","request":"not-requested","verification":"unverified"},"operation_id":"operation-1","status":"unattempted"}],"status":"rejected","workflow_id":"canonical-stage-2-no-op"}}
