{"diagnostics":[{"code":"GVE-S2-INVALID-PAYLOAD","diagnostic_id":"gve-diagnostic-sha256:7e4f36764c649e947d8f0a91bd13e33673c04afa6c0793881baa9b6c1dc48f0e","message":"The plugin routing envelope contains an unknown governed member.","request_id":"gve-request-sha256:e44556b6460d6e76b2993e8049e653db43027048c5ece22b5f5e7614b21c145c","scope":"request","stage":"payload-validation"}],"lifecycle":"no-op","process":{"exit_code":2,"stderr":"empty","stdout":"authoritative-result"},"processing":{"failure_stage":"payload-validation","status":"rejected"},"request_id":"gve-request-sha256:e44556b6460d6e76b2993e8049e653db43027048c5ece22b5f5e7614b21c145c","result_id":"gve-result-sha256:2afe1eaf357e40c53e088ad6a57595464a9c62edb63d3acdafa9d757e1a0bf79","schema_version":1,"workflow":{"effects":{"authorization":"indeterminate","execution":"unattempted","observation":"unobserved","request":"not-requested","verification":"unverified"},"operations":[{"effects":{"authorization":"indeterminate","execution":"unattempted","observation":"unobserved","request":"not-requested","verification":"unverified"},"operation_id":"operation-1","status":"unattempted"}],"status":"rejected","workflow_id":"canonical-stage-2-no-op"}}
