{"diagnostics":[{"code":"GVE-S2-INVALID-PAYLOAD","diagnostic_id":"gve-diagnostic-sha256:ade68b97e549cb57161862e738cf8fb7a31b8b058f9590ac1d1ca2ff0a19bbf7","message":"The common payload contains an unknown top-level governed member.","request_id":"gve-request-sha256:2fc883340c95685c1318a7474baf28f356e73f966d71830433b782518a12dc2d","scope":"request","stage":"payload-validation"}],"lifecycle":"no-op","process":{"exit_code":2,"stderr":"empty","stdout":"authoritative-result"},"processing":{"failure_stage":"payload-validation","status":"rejected"},"request_id":"gve-request-sha256:2fc883340c95685c1318a7474baf28f356e73f966d71830433b782518a12dc2d","result_id":"gve-result-sha256:71421073f2ca8b4c697fd74414648fb43f8476571fbf46b3e14dae7bb1d11424","schema_version":1,"workflow":{"effects":{"authorization":"indeterminate","execution":"unattempted","observation":"unobserved","request":"not-requested","verification":"unverified"},"operations":[{"effects":{"authorization":"indeterminate","execution":"unattempted","observation":"unobserved","request":"not-requested","verification":"unverified"},"operation_id":"operation-1","status":"unattempted"}],"status":"rejected","workflow_id":"canonical-stage-2-no-op"}}
