{"diagnostics":[{"code":"GVE-S2-INVALID-PAYLOAD","diagnostic_id":"gve-diagnostic-sha256:8018ec4f6c8cf2bef85f112ecb54912781ac13db068a99995c89d821498746b9","message":"The Stage 2 payload names an unsupported lifecycle value.","request_id":"gve-request-sha256:71c4babf9ced4440db3513bf2cc9c10b5591d2885be20fd3ab3994681688003a","scope":"request","stage":"payload-validation"}],"lifecycle":"no-op","process":{"exit_code":2,"stderr":"empty","stdout":"authoritative-result"},"processing":{"failure_stage":"payload-validation","status":"rejected"},"request_id":"gve-request-sha256:71c4babf9ced4440db3513bf2cc9c10b5591d2885be20fd3ab3994681688003a","result_id":"gve-result-sha256:d8d3a3367117782e6a0c454f45f2fc489947e856c2e7e53f1608ef325fee3e33","schema_version":1,"workflow":{"effects":{"authorization":"indeterminate","execution":"unattempted","observation":"unobserved","request":"not-requested","verification":"unverified"},"operations":[{"effects":{"authorization":"indeterminate","execution":"unattempted","observation":"unobserved","request":"not-requested","verification":"unverified"},"operation_id":"operation-1","status":"unattempted"}],"status":"rejected","workflow_id":"canonical-stage-2-no-op"}}
