{"diagnostics":[{"code":"GVE-S2-INVALID-PAYLOAD","diagnostic_id":"gve-diagnostic-sha256:45c084e7ded46c229f463d6d63ee7d75e92238d49f4bedbd15cabd1f44bca94c","message":"The Stage 2 payload omits the required lifecycle member.","request_id":"gve-request-sha256:0e3ce6f451cd8cd8bc0ae4e538ae8d190e56bf318f74b225f5d8910881e665c0","scope":"request","stage":"payload-validation"}],"lifecycle":"no-op","process":{"exit_code":2,"stderr":"empty","stdout":"authoritative-result"},"processing":{"failure_stage":"payload-validation","status":"rejected"},"request_id":"gve-request-sha256:0e3ce6f451cd8cd8bc0ae4e538ae8d190e56bf318f74b225f5d8910881e665c0","result_id":"gve-result-sha256:00b0a46d081785d4049886c96a8eaa02e5eec7c4d28078e72ec702c74b677f5c","schema_version":1,"workflow":{"effects":{"authorization":"indeterminate","execution":"unattempted","observation":"unobserved","request":"not-requested","verification":"unverified"},"operations":[{"effects":{"authorization":"indeterminate","execution":"unattempted","observation":"unobserved","request":"not-requested","verification":"unverified"},"operation_id":"operation-1","status":"unattempted"}],"status":"rejected","workflow_id":"canonical-stage-2-no-op"}}
