{"diagnostics":[],"lifecycle":"no-op","process":{"exit_code":0,"stderr":"empty","stdout":"authoritative-result"},"processing":{"failure_stage":null,"status":"succeeded"},"request_id":"gve-request-sha256:a93eba25f58dd70debf8a32253b95327fd13338bc83af4d081417432b0fb53d5","result_id":"gve-result-sha256:9a792196c352139c27b3e3e0ec9c3e5f89dd1f4c63bcf452d2cd87821769dd9f","schema_version":1,"workflow":{"effects":{"authorization":"indeterminate","execution":"unattempted","observation":"unobserved","request":"not-requested","verification":"unverified"},"operations":[{"effects":{"authorization":"indeterminate","execution":"unattempted","observation":"unobserved","request":"not-requested","verification":"unverified"},"operation_id":"operation-1","status":"no-op"}],"status":"no-op-completed","workflow_id":"canonical-stage-2-no-op"}}
