{"diagnostics":[{"code":"GVE-S2-INVALID-PAYLOAD","diagnostic_id":"gve-diagnostic-sha256:81d6fb95fa5843990c9416265617d7b8ff7471ae0511b5ff057cbd2427ddf688","message":"The operation envelope contains a forbidden execution member.","request_id":"gve-request-sha256:4f970b900c545df77f747c2cf83f35f5db52050bad70134b92e90c8d6a61fcb1","scope":"request","stage":"payload-validation"}],"lifecycle":"no-op","process":{"exit_code":2,"stderr":"empty","stdout":"authoritative-result"},"processing":{"failure_stage":"payload-validation","status":"rejected"},"request_id":"gve-request-sha256:4f970b900c545df77f747c2cf83f35f5db52050bad70134b92e90c8d6a61fcb1","result_id":"gve-result-sha256:6ef77abc20ced60c9c88d2c7dc2072e853841b8e06668a28234fde600e412a99","schema_version":1,"workflow":{"effects":{"authorization":"indeterminate","execution":"unattempted","observation":"unobserved","request":"not-requested","verification":"unverified"},"operations":[{"effects":{"authorization":"indeterminate","execution":"unattempted","observation":"unobserved","request":"not-requested","verification":"unverified"},"operation_id":"operation-1","status":"unattempted"}],"status":"rejected","workflow_id":"canonical-stage-2-no-op"}}
